{
  "record_type": "accessioned_jersey",
  "record_id": "26.0017",
  "accession_id": "26.0017",
  "title": "Autographed Dani George Jersey",
  "slug": "26-0017-autographed-dani-george-jersey",
  "wall_status": "current_holding",
  "provenance_label": "From the Leary Locker",
  "inventory_item_name": "Autographed Dani George Jersey",
  "inventory_source": "Leary Locker",
  "description": "Dani George is an elite BMX racer who has competed internationally and represented Supercross BMX, a performance-focused BMX racing brand founded by Bill Ryan. Riders on the Supercross team compete in major BMX racing events worldwide, helping represent the continued growth of elite women’s BMX racing.",
  "additional_context": "Supercross BMX, founded by Bill Ryan, is known for producing high-performance BMX racing frames and supporting elite riders around the world. Athletes such as Dani George represent the continued growth and international presence of women competing at the highest levels of BMX racing.",
  "associated_people": [
    "Dani George"
  ],
  "teams_brands_organizations": [
    "Supercross BMX"
  ],
  "source_social_image": "source/social/26-0017-dani-george-source-post.png",
  "wall_card_image": "assets/wall-cards/26-0017.png",
  "live_collection_url": "https://sites.google.com/view/lititzbmxinventorylist/collections/jersey-collection",
  "notes": []
}
