{
  "record_type": "accessioned_jersey",
  "record_id": "26.0018",
  "accession_id": "26.0018",
  "title": "Harry Leary “Leary” “81” Redman Jersey",
  "slug": "26-0018-harry-leary-leary-81-redman-jersey",
  "wall_status": "current_holding",
  "provenance_label": "From the Leary Locker",
  "inventory_item_name": "Leary \"81\" Redman jersey",
  "inventory_source": "Leary Locker",
  "description": "Redman BMX was a BMX racing brand active during the late 1970s and early 1980s. The company produced frames and racing apparel and was associated with riders such as Harry Leary, who competed on the Redman team during the early years of his career. Redman represents the era when small independent manufacturers helped shape the early development of organized BMX racing.",
  "additional_context": "Early BMX brands such as Redman BMX were often small independent companies that supported local and regional racers during the formative years of the sport. Riders like Harry Leary helped bring visibility to these brands through competition and magazine coverage during the late 1970s and early 1980s.",
  "associated_people": [
    "Harry Leary"
  ],
  "teams_brands_organizations": [
    "Redman BMX"
  ],
  "source_social_image": "source/social/26-0018-redman-81-source-post.png",
  "wall_card_image": "assets/wall-cards/26-0018.png",
  "live_collection_url": "https://sites.google.com/view/lititzbmxinventorylist/collections/jersey-collection",
  "notes": []
}
