{
  "record_type": "accessioned_jersey",
  "record_id": "26.0082",
  "accession_id": "26.0082",
  "title": "Specialized Jersey",
  "slug": "26-0082-specialized-jersey",
  "wall_status": "current_holding",
  "provenance_label": "From the Leary Locker",
  "inventory_item_name": "Specialized Jersey",
  "inventory_source": "Leary Locker",
  "description": "This Specialized racing jersey represents the long-standing involvement of Specialized Bicycle Components in BMX and cycling culture. Jerseys like this were worn by riders and team members during races and promotional events, reflecting the brand identity and sponsorship presence that became a central part of competitive BMX.",
  "additional_context": "Racing jersey produced by Specialized Bicycle Components, reflecting the company’s long-standing involvement in BMX and cycling culture. Jerseys like this were worn by riders and team members during competitions and promotional events, representing the brand identity and sponsorship presence that became central to modern BMX racing.",
  "associated_people": [
    "Harry Leary"
  ],
  "teams_brands_organizations": [
    "Specialized"
  ],
  "source_social_image": null,
  "wall_card_image": "assets/wall-cards/26-0082.png",
  "live_collection_url": "https://sites.google.com/view/lititzbmxinventorylist/collections/jersey-collection",
  "notes": []
}
