{
  "record_type": "accessioned_jersey",
  "record_id": "26.0022",
  "accession_id": "26.0022",
  "title": "Greg Hill GHP Jersey",
  "slug": "26-0022-greg-hill-ghp-jersey",
  "wall_status": "current_holding",
  "provenance_label": "From the Leary Locker",
  "inventory_item_name": "Greg Hill GHP Jersey",
  "inventory_source": "Leary Locker",
  "description": "This GHP team jersey represents BMX champion Greg Hill and his brand Greg Hill Products (GHP). Hill was one of the most dominant BMX racers of the 1980s, winning multiple national titles and later founding GHP to produce BMX racing frames and equipment. Jerseys like this reflect the transition of elite riders into brand builders within the BMX industry.",
  "additional_context": "GHP equipment and team apparel became closely associated with competitive BMX racing during the late 1980s and early 1990s, reflecting the influence of rider-driven companies within the sport.",
  "associated_people": [
    "Greg Hill",
    "Harry Leary"
  ],
  "teams_brands_organizations": [
    "GHP"
  ],
  "source_social_image": "source/social/26-0022-greg-hill-ghp-source-post.png",
  "wall_card_image": "assets/wall-cards/26-0022.png",
  "live_collection_url": "https://sites.google.com/view/lititzbmxinventorylist/collections/jersey-collection",
  "notes": []
}
