{
  "record_type": "accessioned_jersey",
  "record_id": "26.0073",
  "accession_id": "26.0073",
  "title": "ACE Jersey — Given to Harry Leary in Australia",
  "slug": "26-0073-ace-jersey-given-to-harry-leary-in-australia",
  "wall_status": "current_holding",
  "provenance_label": "From the Leary Locker",
  "inventory_item_name": "ACE Jersey\nGiven to Harry Leary in Australia",
  "inventory_source": "Leary Locker",
  "description": "A rare piece of international BMX history: an original ACE (Australian Cycling Enterprises) jersey presented to Harry Leary during his competitive tours in Australia. This garment signifies the global expansion of the sport and the cross-continental influence of U.S. Factory Pros. A vital 'Survivor' piece that documents Harry's status as a global ambassador for the sport.",
  "additional_context": "Original ACE (Australian Cycling Enterprises) jersey presented to Harry Leary during one of his competitive tours in Australia. The garment reflects the growing international reach of BMX during the 1980s and the role of American professional riders in promoting the sport abroad. As a presentation piece tied to Leary’s travels, it documents BMX’s early global expansion.",
  "associated_people": [
    "Harry Leary"
  ],
  "teams_brands_organizations": [
    "ACE",
    "Australian Cycling Enterprises"
  ],
  "source_social_image": null,
  "wall_card_image": "assets/wall-cards/26-0073.png",
  "live_collection_url": "https://sites.google.com/view/lititzbmxinventorylist/collections/jersey-collection",
  "notes": []
}
