{
  "record_type": "accessioned_jersey",
  "record_id": "26.0026",
  "accession_id": "26.0026",
  "title": "GHP Jersey",
  "slug": "26-0026-ghp-jersey",
  "wall_status": "current_holding",
  "provenance_label": "From the Leary Locker",
  "inventory_item_name": "GHP Jersey",
  "inventory_source": "Leary Locker",
  "description": "This GHP team jersey represents the BMX racing brand Greg Hill Products, founded by BMX champion Greg Hill. GHP became known for producing high-performance BMX racing frames and equipment, continuing Hill’s influence on the sport following his dominant racing career in the 1980s.",
  "additional_context": "Greg Hill Products (GHP) was founded by BMX champion Greg Hill, one of the most dominant racers of the 1980s. Hill won numerous national championships and international titles, including the IBMXF World Championship in 1985, helping establish GHP as a respected name in BMX racing equipment and rider-driven design.",
  "associated_people": [
    "Harry Leary",
    "Greg Hill"
  ],
  "teams_brands_organizations": [
    "GHP"
  ],
  "source_social_image": "source/social/26-0026-ghp-source-post.png",
  "wall_card_image": "assets/wall-cards/26-0026.png",
  "live_collection_url": "https://sites.google.com/view/lititzbmxinventorylist/collections/jersey-collection",
  "notes": []
}
