{
  "record_type": "accessioned_jersey",
  "record_id": "26.0021",
  "accession_id": "26.0021",
  "title": "Leary Thrill ROC 1 Jersey",
  "slug": "26-0021-leary-thrill-roc-1-jersey",
  "wall_status": "current_holding",
  "provenance_label": "From the Leary Locker",
  "inventory_item_name": "Leary Thrill ROC 1 Jersey",
  "inventory_source": "Leary Locker",
  "description": "This Thrill ROC #1 jersey was worn by BMX legend Harry Leary during his racing career. Jerseys like this represent the factory team identity and rider branding that helped define BMX racing culture during the sport’s early years.",
  "additional_context": "The ROC #1 designation refers to the Race of Champions, one of the most prestigious events in BMX racing, where riders compete for the title against top competitors from across the sport. Winning the ROC allows the rider to carry the #1 plate designation, marking them as the event champion.",
  "associated_people": [
    "Harry Leary"
  ],
  "teams_brands_organizations": [
    "Thrill",
    "Race of Champions"
  ],
  "source_social_image": "source/social/26-0021-thrill-roc-1-source-post.png",
  "wall_card_image": "assets/wall-cards/26-0021.png",
  "live_collection_url": "https://sites.google.com/view/lititzbmxinventorylist/collections/jersey-collection",
  "notes": []
}
