{
  "record_type": "accessioned_jersey",
  "record_id": "26.0027",
  "accession_id": "26.0027",
  "title": "John Stancliff Jersey",
  "slug": "26-0027-john-stancliff-jersey",
  "wall_status": "current_holding",
  "provenance_label": "From John Stancliff",
  "inventory_item_name": "Stancliff Jersey",
  "inventory_source": "John Stancliff",
  "description": "This BMX racing jersey belonged to local rider John Stancliff, representing the grassroots level of BMX competition that has always been the foundation of the sport. While professional racers often receive the most recognition, local riders like Stancliff played an important role in sustaining BMX racing communities through weekly track events and regional competitions. Artifacts such as this jersey help document the everyday racers who formed the backbone of BMX culture at local tracks.",
  "additional_context": "Local Rider Jersey (John Stancliff): The original Lititz BMX track operated in Lititz, Pennsylvania during the early years of organized BMX racing in the region and helped introduce many local riders to the sport. Tracks like this were typically community-built facilities that formed the foundation of grassroots BMX racing before the sport became more widely organized under national sanctioning bodies.",
  "associated_people": [
    "John Stancliff"
  ],
  "teams_brands_organizations": [
    "Grassroots BMX"
  ],
  "source_social_image": null,
  "wall_card_image": "assets/wall-cards/26-0027.png",
  "live_collection_url": "https://sites.google.com/view/lititzbmxinventorylist/collections/jersey-collection",
  "notes": []
}
