{
  "record_type": "accessioned_jersey",
  "record_id": "26.0025",
  "accession_id": "26.0025",
  "title": "Leary Fasthouse “4” Jersey",
  "slug": "26-0025-leary-fasthouse-4-jersey",
  "wall_status": "current_holding",
  "provenance_label": "From the Leary Locker",
  "inventory_item_name": "Leary Fasthouse \"4\" Jersey",
  "inventory_source": "Leary Locker",
  "description": "This Fasthouse jersey represents BMX pioneer Harry Leary and reflects the continued recognition of Leary’s legacy within BMX culture. Produced by Fasthouse, jerseys like this celebrate the influence of early BMX legends whose riding helped shape the sport’s development.",
  "additional_context": "Fasthouse is a California motorsports apparel brand inspired by vintage motocross and BMX racing culture.",
  "associated_people": [
    "Harry Leary"
  ],
  "teams_brands_organizations": [
    "Fasthouse"
  ],
  "source_social_image": "source/social/26-0025-fasthouse-source-post.png",
  "wall_card_image": "assets/wall-cards/26-0025.png",
  "live_collection_url": "https://sites.google.com/view/lititzbmxinventorylist/collections/jersey-collection",
  "notes": []
}
