{
  "record_type": "continued_journey",
  "record_id": "JER-TR-001",
  "accession_id": null,
  "title": "Harry Leary BIOLAB “25” Jersey",
  "slug": "jer-tr-001-harry-leary-biolab-25-jersey",
  "wall_status": "no_longer_held",
  "provenance_label": "From the Leary Locker",
  "disposition": "Gifted to a friend of Harry Leary",
  "description": "This jersey remains part of the Lititz BMX documentary record, but it is not represented as a current physical holding. Its preserved disposition is: Gifted to a friend of Harry Leary.",
  "associated_people": [
    "Harry Leary"
  ],
  "teams_brands_organizations": [
    "BIOLAB Sciences"
  ],
  "wall_card_image": "assets/wall-cards/jer-tr-001.png",
  "live_collection_url": "https://sites.google.com/view/lititzbmxinventorylist/collections/jersey-collection",
  "notes": [
    "Preserved as a transfer, gift, return, or charitable-disposition record; not presented as a current Lititz BMX holding."
  ]
}
