{
  "record_type": "accessioned_jersey",
  "record_id": "26.0078",
  "accession_id": "26.0078",
  "title": "Harry Leary Memorial Jersey",
  "slug": "26-0078-harry-leary-memorial-jersey",
  "wall_status": "current_holding",
  "provenance_label": "From Greg Mathias",
  "inventory_item_name": "Harry Leary Memorial Jersey",
  "inventory_source": "Greg Mathias",
  "description": "This Harry Leary memorial jersey was produced for a gathering held to celebrate the life and legacy of BMX pioneer Harry Leary at Dirtyfest 3. The jerseys were created by fellow BMX racer Greg Mathias for the event, which brought together riders and friends from across the BMX community to honor Leary’s lasting impact on the sport.",
  "additional_context": "Commemorative jersey produced for the gathering held during Dirtyfest 3 to celebrate the life and legacy of BMX pioneer Harry Leary. Designed and produced by fellow racer Greg Mathias, the jerseys were worn by friends and riders who attended the event honoring Leary’s contributions to BMX culture and racing history.",
  "associated_people": [
    "Harry Leary",
    "Greg Mathias"
  ],
  "teams_brands_organizations": [
    "Fall Risk Racing",
    "Dirtyfest 3"
  ],
  "source_social_image": null,
  "wall_card_image": "assets/wall-cards/26-0078.png",
  "live_collection_url": "https://sites.google.com/view/lititzbmxinventorylist/collections/jersey-collection",
  "notes": []
}
