{
  "record_type": "accessioned_jersey",
  "record_id": "26.0085",
  "accession_id": "26.0085",
  "title": "Auburn Jersey",
  "slug": "26-0085-auburn-jersey",
  "wall_status": "current_holding",
  "provenance_label": "Purchased online",
  "inventory_item_name": "Auburn Jersey",
  "inventory_source": "Online",
  "description": "This Auburn racing jersey represents the BMX brand Auburn Bicycles, known for producing high-performance BMX frames and equipment during the `908's and 1990s. Auburn played an important role in BMX racing during this period, supporting riders and contributing to the development of competitive BMX technology and team culture.",
  "additional_context": "Racing jersey representing Auburn Bicycles, a BMX manufacturer known for producing high-performance frames and equipment during the late 1980s and 1990s. Auburn contributed to the development of competitive BMX technology and supported riders during a formative period of modern BMX racing.",
  "associated_people": [],
  "teams_brands_organizations": [
    "Auburn Bicycles"
  ],
  "source_social_image": null,
  "wall_card_image": "assets/wall-cards/26-0085.png",
  "live_collection_url": "https://sites.google.com/view/lititzbmxinventorylist/collections/jersey-collection",
  "notes": []
}
