{
  "record_type": "accessioned_jersey",
  "record_id": "26.0081",
  "accession_id": "26.0081",
  "title": "Fall Risk Racing “Mathias” Jersey",
  "slug": "26-0081-fall-risk-racing-mathias-jersey",
  "wall_status": "current_holding",
  "provenance_label": "From Greg Mathias",
  "inventory_item_name": "Fall Risk Racing \"Mathias\" Jersey",
  "inventory_source": "Greg Mathias",
  "description": "This Fall Risk Racing “Mathias” jersey was gifted by BMX racer Greg Mathias to Lititz BMX in gratitude after the archive presented him with the 2017 Team USA “Learry” jersey discovered within the Leary Locker collection. The jersey reflects the camaraderie within the BMX community and the collaborative effort to preserve and share the sport’s history.",
  "additional_context": "Fall Risk Racing team jersey worn by Greg Mathias and donated to the Lititz BMX Archive as part of the same exchange surrounding the recovery of the Team USA “Leary” jersey from the Leary Locker collection. The artifact highlights the close-knit nature of the BMX community and the cooperation between riders and historians in safeguarding BMX heritage.",
  "associated_people": [
    "Greg Mathias",
    "Harry Leary"
  ],
  "teams_brands_organizations": [
    "Fall Risk Racing"
  ],
  "source_social_image": null,
  "wall_card_image": "assets/wall-cards/26-0081.png",
  "live_collection_url": "https://sites.google.com/view/lititzbmxinventorylist/collections/jersey-collection",
  "notes": []
}
