{
  "record_type": "accessioned_jersey",
  "record_id": "26.0024",
  "accession_id": "26.0024",
  "title": "Greg Mathias Signed Team USA Jersey",
  "slug": "26-0024-greg-mathias-signed-team-usa-jersey",
  "wall_status": "current_holding",
  "provenance_label": "From Greg Mathias",
  "inventory_item_name": "Greg Mathias Signed Team USA Jersey",
  "inventory_source": "Greg Mathias",
  "description": "This Team USA jersey signed by Greg Mathias features a design inspired by the classic JMC Racing style associated with Mathias during his BMX racing career. Mathias was one of the top BMX racers of the early 1980s, and memorabilia like this jersey reflects his contributions to the sport and the enduring influence of the JMC brand in BMX racing history.",
  "additional_context": "\"USA BMX is stoked to reveal this year's Team USA jersey, which is a direct nod to the patriotic look of an iconic American BMX brand - JMC Racing ... specifically, with a salute to the stylish BMX Hall of Famer from Oregon, Darrell Young.\r\n\r\nThese jerseys will be worn by American racers attending the UCI World Championships in Nantes, France - held during July 26-31, 2022. Traditionally, at the end of each Worlds, attendees trade their jerseys with fellow competitors from other countries - and U.S. jerseys are always a much sought-after item. \r\n\r\nFor those curious on their BMX history, research Team USA's classic look by googling JMC and Darrell Young. All of us hope to see this year's squad channel their inner-DY, and not only be as fast as him, but just as smooth.\"",
  "associated_people": [
    "Greg Mathias"
  ],
  "teams_brands_organizations": [
    "Team USA",
    "USA BMX",
    "JMC Racing"
  ],
  "source_social_image": "source/social/26-0024-team-usa-source-post.png",
  "wall_card_image": "assets/wall-cards/26-0024.png",
  "live_collection_url": "https://sites.google.com/view/lititzbmxinventorylist/collections/jersey-collection",
  "notes": []
}
