{
  "record_type": "continued_journey",
  "record_id": "JER-TR-002",
  "accession_id": null,
  "title": "Harry Leary DIRTWERX Jersey",
  "slug": "jer-tr-002-harry-leary-dirtwerx-jersey",
  "wall_status": "no_longer_held",
  "provenance_label": "From the Leary Locker",
  "disposition": "Gifted to Justin Dumas",
  "description": "This jersey remains part of the Lititz BMX documentary record, but it is not represented as a current physical holding. Its preserved disposition is: Gifted to Justin Dumas.",
  "associated_people": [
    "Harry Leary",
    "Justin Dumas"
  ],
  "teams_brands_organizations": [
    "DIRTWERX"
  ],
  "wall_card_image": "assets/wall-cards/jer-tr-002.png",
  "live_collection_url": "https://sites.google.com/view/lititzbmxinventorylist/collections/jersey-collection",
  "notes": [
    "Preserved as a transfer, gift, return, or charitable-disposition record; not presented as a current Lititz BMX holding."
  ]
}
