{
  "record_type": "accessioned_jersey",
  "record_id": "26.0083",
  "accession_id": "26.0083",
  "title": "Marzocchi Free Ride Team Jersey",
  "slug": "26-0083-marzocchi-free-ride-team-jersey",
  "wall_status": "current_holding",
  "provenance_label": "From the Leary Locker",
  "inventory_item_name": "Marzocchi Free Ride Team Jersey",
  "inventory_source": "Leary Locker",
  "description": "This Free Ride Team jersey from Marzocchi represents the company’s involvement in freestyle and off-road cycling disciplines. Marzocchi became widely known for producing high-performance suspension forks used in BMX, mountain biking, and freeride competitions, and team apparel like this reflects the brand’s presence within action sports culture.",
  "additional_context": "Team jersey produced by Marzocchi, a company widely known for manufacturing high-performance suspension forks used in BMX, mountain biking, and freeride disciplines. Apparel such as this reflects Marzocchi’s strong presence within action sports culture and its support of riders competing in gravity and freestyle-oriented cycling events.",
  "associated_people": [
    "Harry Leary"
  ],
  "teams_brands_organizations": [
    "Marzocchi"
  ],
  "source_social_image": null,
  "wall_card_image": "assets/wall-cards/26-0083.png",
  "live_collection_url": "https://sites.google.com/view/lititzbmxinventorylist/collections/jersey-collection",
  "notes": []
}
