{
  "record_type": "accessioned_jersey",
  "record_id": "26.0080",
  "accession_id": "26.0080",
  "title": "Fall Risk Racing “Leary” Jersey",
  "slug": "26-0080-fall-risk-racing-leary-jersey",
  "wall_status": "current_holding",
  "provenance_label": "From Greg Mathias",
  "inventory_item_name": "Fall Risk Racing \"Leary\" Jersey",
  "inventory_source": "Greg Mathias",
  "description": "This Fall Risk Racing “Leary” jersey was gifted by BMX racer Greg Mathias in gratitude to Lititz BMX after the archive presented him with the 2017 Team USA “Learry” jersey discovered within the Leary Locker collection. The exchange reflects the strong sense of community and mutual respect within BMX, where riders and historians often work together to preserve and share the sport’s history.",
  "additional_context": "Fall Risk Racing team jersey bearing Harry Leary’s name, gifted by BMX racer Greg Mathias to the Lititz BMX Archive. The jersey was presented in gratitude after the archive returned a 2017 Team USA “Leary” jersey discovered within the Leary Locker collection. The exchange reflects the collaborative spirit within BMX culture and the shared effort to preserve the sport’s history.",
  "associated_people": [
    "Harry Leary",
    "Greg Mathias"
  ],
  "teams_brands_organizations": [
    "Fall Risk Racing"
  ],
  "source_social_image": null,
  "wall_card_image": "assets/wall-cards/26-0080.png",
  "live_collection_url": "https://sites.google.com/view/lititzbmxinventorylist/collections/jersey-collection",
  "notes": []
}
