{
  "record_type": "accessioned_jersey",
  "record_id": "26.0019",
  "accession_id": "26.0019",
  "title": "Connor Fields Signed Factory Misprint Jersey",
  "slug": "26-0019-connor-fields-signed-factory-misprint-jersey",
  "wall_status": "current_holding",
  "provenance_label": "From the Leary Locker",
  "inventory_item_name": "Connor Fields Signed Factory Misprint Jersey",
  "inventory_source": "Leary Locker",
  "description": "This factory Answer BMX team jersey worn by Olympic champion Connor Fields is signed by the rider and carries a unique connection to BMX legend Harry Leary. The jersey was sent to Leary after he recognized it during a giveaway of items from Fields’ personal collection. The piece also features a rare factory misprint, with Fields’ name incorrectly spelled “Conner Fields,” making it a distinctive artifact linking two generations of BMX racing history.",
  "additional_context": "This factory Answer BMX team jersey worn by Olympic champion Connor Fields is signed by the rider and carries a unique connection to BMX legend Harry Leary. The jersey was sent to Leary after he recognized it during a giveaway of items from Fields’ personal collection. The piece also features a rare factory misprint, with Fields’ name incorrectly spelled “Conner Fields,” making it a distinctive artifact linking two generations of BMX racing history.",
  "associated_people": [
    "Connor Fields",
    "Harry Leary"
  ],
  "teams_brands_organizations": [
    "Answer BMX"
  ],
  "source_social_image": "source/social/26-0019-connor-fields-source-post.png",
  "wall_card_image": "assets/wall-cards/26-0019.png",
  "live_collection_url": "https://sites.google.com/view/lititzbmxinventorylist/collections/jersey-collection",
  "notes": []
}
