{
  "record_type": "accessioned_jersey",
  "record_id": "26.0074",
  "accession_id": "26.0074",
  "title": "Peak “Leary” Jersey",
  "slug": "26-0074-peak-leary-jersey",
  "wall_status": "current_holding",
  "provenance_label": "From the Leary Locker",
  "inventory_item_name": "Peak \"Leary\" Jersey",
  "inventory_source": "Leary Locker",
  "description": "A rare co-branded artifact from the peak of Harry Leary's career: the Peak Performance x BIOLAB factory jersey. This piece documents a pivotal era where BMX moved into the realm of high-performance athletics, with BIOLAB serving as the sport's early leader in rider conditioning and sports science. Featuring the iconic neon-heavy sublimation of Peak and the distinctive BIOLAB 'laboratory' branding.",
  "additional_context": "Co-branded Peak Performance and BIOLAB factory team jersey associated with Harry Leary during the height of his professional career. The design features the vibrant neon sublimation style characteristic of late-1980s performance racewear along with BIOLAB branding, a company known for promoting rider conditioning and sports science within BMX. The jersey reflects a period when BMX increasingly embraced high-performance athletic training.",
  "associated_people": [
    "Harry Leary"
  ],
  "teams_brands_organizations": [
    "Peak Performance",
    "BIOLAB Sciences"
  ],
  "source_social_image": null,
  "wall_card_image": "assets/wall-cards/26-0074.png",
  "live_collection_url": "https://sites.google.com/view/lititzbmxinventorylist/collections/jersey-collection",
  "notes": []
}
