{
  "record_type": "continued_journey",
  "record_id": "JER-TR-005",
  "accession_id": null,
  "title": "Harry Leary Redman Jersey",
  "slug": "jer-tr-005-harry-leary-redman-jersey",
  "wall_status": "no_longer_held",
  "provenance_label": "From the Leary Locker",
  "disposition": "Donated for a Samaritan’s Purse charity auction with Damian Fulton",
  "description": "This jersey remains part of the Lititz BMX documentary record, but it is not represented as a current physical holding. Its preserved disposition is: Donated for a Samaritan’s Purse charity auction with Damian Fulton.",
  "associated_people": [
    "Harry Leary",
    "Damian Fulton"
  ],
  "teams_brands_organizations": [
    "Redman BMX",
    "Samaritan’s Purse",
    "Radical Rick"
  ],
  "wall_card_image": "assets/wall-cards/jer-tr-005.png",
  "live_collection_url": "https://sites.google.com/view/lititzbmxinventorylist/collections/jersey-collection",
  "notes": [
    "Preserved as a transfer, gift, return, or charitable-disposition record; not presented as a current Lititz BMX holding."
  ]
}
