{
  "record_type": "accessioned_jersey",
  "record_id": "26.0086",
  "accession_id": "26.0086",
  "title": "BIOLAB “Leary” “25” Jersey",
  "slug": "26-0086-biolab-leary-25-jersey",
  "wall_status": "current_holding",
  "provenance_label": "From the Leary Locker",
  "inventory_item_name": "BIOLAB \"Leary\" \"25\" Jersey",
  "inventory_source": "Leary Locker",
  "description": "This BIOLAB “Leary 25” jersey was worn by BMX pioneer Harry Leary during his later racing years. Sponsored by BIOLAB, the jersey reflects Leary’s continued involvement in competitive BMX decades after helping define the sport’s early racing era.",
  "additional_context": "Racing jersey worn by BMX pioneer Harry Leary during his later competitive years while sponsored by BIOLAB Sciences. Featuring Leary’s name and race number “25,” the jersey reflects his continued presence in BMX competition decades after helping shape the sport’s early professional racing era.",
  "associated_people": [
    "Harry Leary"
  ],
  "teams_brands_organizations": [
    "BIOLAB Sciences"
  ],
  "source_social_image": null,
  "wall_card_image": "assets/wall-cards/26-0086.png",
  "live_collection_url": "https://sites.google.com/view/lititzbmxinventorylist/collections/jersey-collection",
  "notes": []
}
